{
  "$schema": "../../schemas/constructs/sprach-a-lyzer_construct-ontology_v0.2.json",
  "ontology_version": "0.2",
  "status": "APPROVED",
  "locale": "de-DE",
  "policy_registry": "0.6",
  "constructs": [
    {
      "id": "GENERALIZATION",
      "layer": "LANGUAGE_FEATURE",
      "inference_class": "OBSERVABLE",
      "definition": "Versionierte sprachliche Abgrenzung für generalization im aktuellen Äußerungs- und Proposition-Kontext.",
      "evidence": [
        "Explizite positive Sprachmarker oder proposition-lokale Fakten für generalization."
      ],
      "non_evidence": [
        "Fehlende Marker, bloße Fragevorgaben oder Schweigen sind keine Evidenz."
      ],
      "allowed_claim": "Im vorliegenden Text ist sprachliche Evidenz für generalization erkennbar.",
      "prohibited_claims": [
        "generalization als dauerhafte Persönlichkeitseigenschaft oder Diagnose behaupten."
      ],
      "claim_mode": "DIRECT_OBSERVATION",
      "assessability": {
        "minimum_distinct_evidence": 1,
        "question_context_required": false,
        "longitudinal_required": false
      },
      "dimension_links": [
        "CLARITY",
        "OPENNESS"
      ],
      "core_scoring": false,
      "runtime_signals": []
    },
    {
      "id": "MODALITY",
      "layer": "LANGUAGE_FEATURE",
      "inference_class": "OBSERVABLE",
      "definition": "Versionierte sprachliche Abgrenzung für modality im aktuellen Äußerungs- und Proposition-Kontext.",
      "evidence": [
        "Explizite positive Sprachmarker oder proposition-lokale Fakten für modality."
      ],
      "non_evidence": [
        "Fehlende Marker, bloße Fragevorgaben oder Schweigen sind keine Evidenz."
      ],
      "allowed_claim": "Im vorliegenden Text ist sprachliche Evidenz für modality erkennbar.",
      "prohibited_claims": [
        "modality als dauerhafte Persönlichkeitseigenschaft oder Diagnose behaupten."
      ],
      "claim_mode": "DIRECT_OBSERVATION",
      "assessability": {
        "minimum_distinct_evidence": 1,
        "question_context_required": false,
        "longitudinal_required": false
      },
      "dimension_links": [
        "VOLITION"
      ],
      "core_scoring": false,
      "runtime_signals": []
    },
    {
      "id": "NEGATION",
      "layer": "LANGUAGE_FEATURE",
      "inference_class": "OBSERVABLE",
      "definition": "Versionierte sprachliche Abgrenzung für negation im aktuellen Äußerungs- und Proposition-Kontext.",
      "evidence": [
        "Explizite positive Sprachmarker oder proposition-lokale Fakten für negation."
      ],
      "non_evidence": [
        "Fehlende Marker, bloße Fragevorgaben oder Schweigen sind keine Evidenz."
      ],
      "allowed_claim": "Im vorliegenden Text ist sprachliche Evidenz für negation erkennbar.",
      "prohibited_claims": [
        "negation als dauerhafte Persönlichkeitseigenschaft oder Diagnose behaupten."
      ],
      "claim_mode": "DIRECT_OBSERVATION",
      "assessability": {
        "minimum_distinct_evidence": 1,
        "question_context_required": false,
        "longitudinal_required": false
      },
      "dimension_links": [
        "CLARITY"
      ],
      "core_scoring": false,
      "runtime_signals": []
    },
    {
      "id": "CERTAINTY",
      "layer": "LANGUAGE_FEATURE",
      "inference_class": "OBSERVABLE",
      "definition": "Versionierte sprachliche Abgrenzung für certainty im aktuellen Äußerungs- und Proposition-Kontext.",
      "evidence": [
        "Explizite positive Sprachmarker oder proposition-lokale Fakten für certainty."
      ],
      "non_evidence": [
        "Fehlende Marker, bloße Fragevorgaben oder Schweigen sind keine Evidenz."
      ],
      "allowed_claim": "Im vorliegenden Text ist sprachliche Evidenz für certainty erkennbar.",
      "prohibited_claims": [
        "certainty als dauerhafte Persönlichkeitseigenschaft oder Diagnose behaupten."
      ],
      "claim_mode": "DIRECT_OBSERVATION",
      "assessability": {
        "minimum_distinct_evidence": 1,
        "question_context_required": false,
        "longitudinal_required": false
      },
      "dimension_links": [
        "CLARITY"
      ],
      "core_scoring": false,
      "runtime_signals": []
    },
    {
      "id": "SPECIFICITY",
      "layer": "LANGUAGE_FEATURE",
      "inference_class": "OBSERVABLE",
      "definition": "Versionierte sprachliche Abgrenzung für specificity im aktuellen Äußerungs- und Proposition-Kontext.",
      "evidence": [
        "Explizite positive Sprachmarker oder proposition-lokale Fakten für specificity."
      ],
      "non_evidence": [
        "Fehlende Marker, bloße Fragevorgaben oder Schweigen sind keine Evidenz."
      ],
      "allowed_claim": "Im vorliegenden Text ist sprachliche Evidenz für specificity erkennbar.",
      "prohibited_claims": [
        "specificity als dauerhafte Persönlichkeitseigenschaft oder Diagnose behaupten."
      ],
      "claim_mode": "DIRECT_OBSERVATION",
      "assessability": {
        "minimum_distinct_evidence": 1,
        "question_context_required": false,
        "longitudinal_required": false
      },
      "dimension_links": [
        "CLARITY"
      ],
      "core_scoring": false,
      "runtime_signals": []
    },
    {
      "id": "TEMPORAL_REFERENCE",
      "layer": "LANGUAGE_FEATURE",
      "inference_class": "OBSERVABLE",
      "definition": "Versionierte sprachliche Abgrenzung für temporal reference im aktuellen Äußerungs- und Proposition-Kontext.",
      "evidence": [
        "Explizite positive Sprachmarker oder proposition-lokale Fakten für temporal reference."
      ],
      "non_evidence": [
        "Fehlende Marker, bloße Fragevorgaben oder Schweigen sind keine Evidenz."
      ],
      "allowed_claim": "Im vorliegenden Text ist sprachliche Evidenz für temporal reference erkennbar.",
      "prohibited_claims": [
        "temporal reference als dauerhafte Persönlichkeitseigenschaft oder Diagnose behaupten."
      ],
      "claim_mode": "DIRECT_OBSERVATION",
      "assessability": {
        "minimum_distinct_evidence": 1,
        "question_context_required": false,
        "longitudinal_required": false
      },
      "dimension_links": [
        "CLARITY"
      ],
      "core_scoring": false,
      "runtime_signals": []
    },
    {
      "id": "PERSON_BEHAVIOR_LABELING",
      "layer": "LANGUAGE_FEATURE",
      "inference_class": "OBSERVABLE",
      "definition": "Versionierte sprachliche Abgrenzung für person behavior labeling im aktuellen Äußerungs- und Proposition-Kontext.",
      "evidence": [
        "Explizite positive Sprachmarker oder proposition-lokale Fakten für person behavior labeling."
      ],
      "non_evidence": [
        "Fehlende Marker, bloße Fragevorgaben oder Schweigen sind keine Evidenz."
      ],
      "allowed_claim": "Im vorliegenden Text ist sprachliche Evidenz für person behavior labeling erkennbar.",
      "prohibited_claims": [
        "person behavior labeling als dauerhafte Persönlichkeitseigenschaft oder Diagnose behaupten."
      ],
      "claim_mode": "DIRECT_OBSERVATION",
      "assessability": {
        "minimum_distinct_evidence": 1,
        "question_context_required": false,
        "longitudinal_required": false
      },
      "dimension_links": [
        "APPRECIATION"
      ],
      "core_scoring": false,
      "runtime_signals": [
        {
          "phrases_any": [
            "ich bin ein fehler",
            "du bist das problem",
            "du bist ein fehler"
          ]
        }
      ]
    },
    {
      "id": "OPTION_COUNT",
      "layer": "LANGUAGE_FEATURE",
      "inference_class": "OBSERVABLE",
      "definition": "Versionierte sprachliche Abgrenzung für option count im aktuellen Äußerungs- und Proposition-Kontext.",
      "evidence": [
        "Explizite positive Sprachmarker oder proposition-lokale Fakten für option count."
      ],
      "non_evidence": [
        "Fehlende Marker, bloße Fragevorgaben oder Schweigen sind keine Evidenz."
      ],
      "allowed_claim": "Im vorliegenden Text ist sprachliche Evidenz für option count erkennbar.",
      "prohibited_claims": [
        "option count als dauerhafte Persönlichkeitseigenschaft oder Diagnose behaupten."
      ],
      "claim_mode": "DIRECT_OBSERVATION",
      "assessability": {
        "minimum_distinct_evidence": 1,
        "question_context_required": false,
        "longitudinal_required": false
      },
      "dimension_links": [
        "OPENNESS"
      ],
      "core_scoring": false,
      "runtime_signals": []
    },
    {
      "id": "COMMITMENT_VERB",
      "layer": "LANGUAGE_FEATURE",
      "inference_class": "OBSERVABLE",
      "definition": "Versionierte sprachliche Abgrenzung für commitment verb im aktuellen Äußerungs- und Proposition-Kontext.",
      "evidence": [
        "Explizite positive Sprachmarker oder proposition-lokale Fakten für commitment verb."
      ],
      "non_evidence": [
        "Fehlende Marker, bloße Fragevorgaben oder Schweigen sind keine Evidenz."
      ],
      "allowed_claim": "Im vorliegenden Text ist sprachliche Evidenz für commitment verb erkennbar.",
      "prohibited_claims": [
        "commitment verb als dauerhafte Persönlichkeitseigenschaft oder Diagnose behaupten."
      ],
      "claim_mode": "DIRECT_OBSERVATION",
      "assessability": {
        "minimum_distinct_evidence": 1,
        "question_context_required": false,
        "longitudinal_required": false
      },
      "dimension_links": [
        "AGENCY",
        "VOLITION"
      ],
      "core_scoring": false,
      "runtime_signals": []
    },
    {
      "id": "EMOTION_WORD",
      "layer": "LANGUAGE_FEATURE",
      "inference_class": "OBSERVABLE",
      "definition": "Versionierte sprachliche Abgrenzung für emotion word im aktuellen Äußerungs- und Proposition-Kontext.",
      "evidence": [
        "Explizite positive Sprachmarker oder proposition-lokale Fakten für emotion word."
      ],
      "non_evidence": [